{
  "schema_version": "econnet-observer-external-uptime/1.0.0",
  "sequence": 227,
  "generated_at": "2026-09-01T17:58:07Z",
  "fresh_until": "2026-09-01T19:18:07Z",
  "producer": "github-actions-external-uptime",
  "observation_window": {
    "started_at": "2026-09-01T17:58:02Z",
    "ended_at": "2026-09-01T17:58:06Z"
  },
  "current_status": "healthy",
  "last_success_at": "2026-09-01T17:58:07Z",
  "last_incident": {
    "incident_id_hash": "c35e2620a1ba1439c93efaa7ba5b85cbd1d366c321e0a7a6f946ecb38d7fc219",
    "failure_category": "content_missing",
    "started_at": "2026-08-24T12:02:13Z",
    "recovered_at": "2026-08-24T21:04:48Z"
  },
  "uptime_24h_basis_points": 0,
  "uptime_30d_basis_points": 0,
  "endpoint_results": [
    {
      "monitor_id_hash": "ee5816560bb7f2fd926b78b7d47bf5281a4b7d7795ad5b8275e9520727e05db8",
      "endpoint_category": "dns",
      "last_check_at": "2026-09-01T17:58:02Z",
      "current_status": "healthy",
      "failure_category": "none",
      "http_status": null,
      "redirect_count": 0,
      "response_time_ms": null,
      "tls_status": "not_applicable",
      "certificate_expires_at": null,
      "dns_status": "resolved",
      "content_status": "not_applicable",
      "consecutive_failures": 0,
      "consecutive_successes": 228,
      "incident_id_hash": null,
      "incident_started_at": null
    },
    {
      "monitor_id_hash": "67fafe5bfcc53d87ac96d3c5c293a8c67d38e3d33837247099f7c1040471fd74",
      "endpoint_category": "tls",
      "last_check_at": "2026-09-01T17:58:02Z",
      "current_status": "healthy",
      "failure_category": "none",
      "http_status": null,
      "redirect_count": 0,
      "response_time_ms": null,
      "tls_status": "valid",
      "certificate_expires_at": "2026-10-20T07:09:46Z",
      "dns_status": "not_applicable",
      "content_status": "not_applicable",
      "consecutive_failures": 0,
      "consecutive_successes": 228,
      "incident_id_hash": null,
      "incident_started_at": null
    },
    {
      "monitor_id_hash": "e85ff9719c86c2f3096b02ffad2bce20d80ff46511147e5fd62d613027b7d148",
      "endpoint_category": "route_no",
      "last_check_at": "2026-09-01T17:58:02Z",
      "current_status": "healthy",
      "failure_category": "none",
      "http_status": 200,
      "redirect_count": 0,
      "response_time_ms": 1321,
      "tls_status": "not_applicable",
      "certificate_expires_at": null,
      "dns_status": "not_applicable",
      "content_status": "present",
      "consecutive_failures": 0,
      "consecutive_successes": 9,
      "incident_id_hash": null,
      "incident_started_at": null
    },
    {
      "monitor_id_hash": "1acfea4abf3c63a1145b3758e40f3602573b818e8a5539576a689d6ca8679c5f",
      "endpoint_category": "route_en",
      "last_check_at": "2026-09-01T17:58:02Z",
      "current_status": "healthy",
      "failure_category": "none",
      "http_status": 200,
      "redirect_count": 0,
      "response_time_ms": 699,
      "tls_status": "not_applicable",
      "certificate_expires_at": null,
      "dns_status": "not_applicable",
      "content_status": "present",
      "consecutive_failures": 0,
      "consecutive_successes": 9,
      "incident_id_hash": null,
      "incident_started_at": null
    },
    {
      "monitor_id_hash": "16e98aac516fe24c913a3330454e44a6e3376ecb1be6241f16a6b16eb3a029e1",
      "endpoint_category": "route_ar",
      "last_check_at": "2026-09-01T17:58:02Z",
      "current_status": "healthy",
      "failure_category": "none",
      "http_status": 200,
      "redirect_count": 0,
      "response_time_ms": 603,
      "tls_status": "not_applicable",
      "certificate_expires_at": null,
      "dns_status": "not_applicable",
      "content_status": "present",
      "consecutive_failures": 0,
      "consecutive_successes": 9,
      "incident_id_hash": null,
      "incident_started_at": null
    }
  ],
  "previous_evidence_fingerprint": "48df45d01450dce56696bf3738ce8583117f8ff0f5825b3bb044106f3fd75fb4",
  "evidence_fingerprint": "3744a851d786c8521da16f3b5e0279a7fb911efcbdad33c594e5be5251270bb2",
  "authentication": {
    "scheme": "ed25519",
    "key_id": "econnet-uptime-ed25519-2026-01",
    "signature_domain": "econnet-observer-external-uptime/1.0.0",
    "signature": "GkXUpgXkdXH9LLte6mTg6ge3l5rfjtruikLyquATv7DDnryzSk9Nb4OI0CtrdaEQwGqGV9bMCqiB032DIAugBw=="
  }
}
