{
  "schema_version": "econnet-observer-external-uptime/1.0.0",
  "sequence": 583,
  "generated_at": "2026-10-30T09:06:24Z",
  "fresh_until": "2026-10-30T10:26:24Z",
  "producer": "github-actions-external-uptime",
  "observation_window": {
    "started_at": "2026-10-30T09:05:15Z",
    "ended_at": "2026-10-30T09:06:23Z"
  },
  "current_status": "down",
  "last_success_at": "2026-09-20T06:26:53Z",
  "last_incident": {
    "incident_id_hash": "a0a73f24198f19b4a4c24fa0d50424a2745f078ff3b770462bffa2ca115e8854",
    "failure_category": "content_missing",
    "started_at": "2026-09-21T19:17:52Z",
    "recovered_at": null
  },
  "uptime_24h_basis_points": 0,
  "uptime_30d_basis_points": 0,
  "endpoint_results": [
    {
      "monitor_id_hash": "ee5816560bb7f2fd926b78b7d47bf5281a4b7d7795ad5b8275e9520727e05db8",
      "endpoint_category": "dns",
      "last_check_at": "2026-10-30T09:05:15Z",
      "current_status": "healthy",
      "failure_category": "none",
      "http_status": null,
      "redirect_count": 0,
      "response_time_ms": null,
      "tls_status": "not_applicable",
      "certificate_expires_at": null,
      "dns_status": "resolved",
      "content_status": "not_applicable",
      "consecutive_failures": 0,
      "consecutive_successes": 584,
      "incident_id_hash": null,
      "incident_started_at": null
    },
    {
      "monitor_id_hash": "67fafe5bfcc53d87ac96d3c5c293a8c67d38e3d33837247099f7c1040471fd74",
      "endpoint_category": "tls",
      "last_check_at": "2026-10-30T09:05:15Z",
      "current_status": "healthy",
      "failure_category": "none",
      "http_status": null,
      "redirect_count": 0,
      "response_time_ms": null,
      "tls_status": "valid",
      "certificate_expires_at": "2026-12-20T06:40:14Z",
      "dns_status": "not_applicable",
      "content_status": "not_applicable",
      "consecutive_failures": 0,
      "consecutive_successes": 214,
      "incident_id_hash": null,
      "incident_started_at": null
    },
    {
      "monitor_id_hash": "e85ff9719c86c2f3096b02ffad2bce20d80ff46511147e5fd62d613027b7d148",
      "endpoint_category": "route_no",
      "last_check_at": "2026-10-30T09:05:15Z",
      "current_status": "down",
      "failure_category": "content_missing",
      "http_status": 200,
      "redirect_count": 0,
      "response_time_ms": 1095,
      "tls_status": "not_applicable",
      "certificate_expires_at": null,
      "dns_status": "not_applicable",
      "content_status": "missing",
      "consecutive_failures": 222,
      "consecutive_successes": 0,
      "incident_id_hash": "a0a73f24198f19b4a4c24fa0d50424a2745f078ff3b770462bffa2ca115e8854",
      "incident_started_at": "2026-09-21T19:17:52Z"
    },
    {
      "monitor_id_hash": "1acfea4abf3c63a1145b3758e40f3602573b818e8a5539576a689d6ca8679c5f",
      "endpoint_category": "route_en",
      "last_check_at": "2026-10-30T09:05:15Z",
      "current_status": "down",
      "failure_category": "content_missing",
      "http_status": 200,
      "redirect_count": 0,
      "response_time_ms": 629,
      "tls_status": "not_applicable",
      "certificate_expires_at": null,
      "dns_status": "not_applicable",
      "content_status": "missing",
      "consecutive_failures": 222,
      "consecutive_successes": 0,
      "incident_id_hash": "a0a73f24198f19b4a4c24fa0d50424a2745f078ff3b770462bffa2ca115e8854",
      "incident_started_at": "2026-09-21T19:17:52Z"
    },
    {
      "monitor_id_hash": "16e98aac516fe24c913a3330454e44a6e3376ecb1be6241f16a6b16eb3a029e1",
      "endpoint_category": "route_ar",
      "last_check_at": "2026-10-30T09:05:15Z",
      "current_status": "down",
      "failure_category": "content_missing",
      "http_status": 200,
      "redirect_count": 0,
      "response_time_ms": 662,
      "tls_status": "not_applicable",
      "certificate_expires_at": null,
      "dns_status": "not_applicable",
      "content_status": "missing",
      "consecutive_failures": 222,
      "consecutive_successes": 0,
      "incident_id_hash": "a0a73f24198f19b4a4c24fa0d50424a2745f078ff3b770462bffa2ca115e8854",
      "incident_started_at": "2026-09-21T19:17:52Z"
    }
  ],
  "previous_evidence_fingerprint": "757dc75199f8b97b3fa328effaf22905a32b640d28115be855e6012594ac4613",
  "evidence_fingerprint": "aa5c77acfedcc1b8da8e668ce8d5e16b2cb4e28058ebead1e934851785415c79",
  "authentication": {
    "scheme": "ed25519",
    "key_id": "econnet-uptime-ed25519-2026-01",
    "signature_domain": "econnet-observer-external-uptime/1.0.0",
    "signature": "jLVFwR7rHYZzkgNsVb5MFkb6wL9MWPqbeoZ6k2p7ek+z1fIp35Fpi02j3OBJ9CIF5xu39P5glCsKChoXBDBLCw=="
  }
}
