{
  "schema_version": "econnet-observer-external-uptime/1.0.0",
  "sequence": 369,
  "generated_at": "2026-09-21T07:05:37Z",
  "fresh_until": "2026-09-21T08:25:37Z",
  "producer": "github-actions-external-uptime",
  "observation_window": {
    "started_at": "2026-09-21T07:04:32Z",
    "ended_at": "2026-09-21T07:05:37Z"
  },
  "current_status": "degraded",
  "last_success_at": "2026-09-20T06:26:53Z",
  "last_incident": {
    "incident_id_hash": "1084caf605b6856546de3de963180da4178f02be7a8ff30cde83702b7d722c83",
    "failure_category": "certificate_expiring_30",
    "started_at": "2026-09-20T11:41:31Z",
    "recovered_at": null
  },
  "uptime_24h_basis_points": 0,
  "uptime_30d_basis_points": 0,
  "endpoint_results": [
    {
      "monitor_id_hash": "ee5816560bb7f2fd926b78b7d47bf5281a4b7d7795ad5b8275e9520727e05db8",
      "endpoint_category": "dns",
      "last_check_at": "2026-09-21T07:04:32Z",
      "current_status": "healthy",
      "failure_category": "none",
      "http_status": null,
      "redirect_count": 0,
      "response_time_ms": null,
      "tls_status": "not_applicable",
      "certificate_expires_at": null,
      "dns_status": "resolved",
      "content_status": "not_applicable",
      "consecutive_failures": 0,
      "consecutive_successes": 370,
      "incident_id_hash": null,
      "incident_started_at": null
    },
    {
      "monitor_id_hash": "67fafe5bfcc53d87ac96d3c5c293a8c67d38e3d33837247099f7c1040471fd74",
      "endpoint_category": "tls",
      "last_check_at": "2026-09-21T07:04:32Z",
      "current_status": "degraded",
      "failure_category": "certificate_expiring_30",
      "http_status": null,
      "redirect_count": 0,
      "response_time_ms": null,
      "tls_status": "expiring",
      "certificate_expires_at": "2026-10-20T07:09:46Z",
      "dns_status": "not_applicable",
      "content_status": "not_applicable",
      "consecutive_failures": 8,
      "consecutive_successes": 0,
      "incident_id_hash": "1084caf605b6856546de3de963180da4178f02be7a8ff30cde83702b7d722c83",
      "incident_started_at": "2026-09-20T11:41:31Z"
    },
    {
      "monitor_id_hash": "e85ff9719c86c2f3096b02ffad2bce20d80ff46511147e5fd62d613027b7d148",
      "endpoint_category": "route_no",
      "last_check_at": "2026-09-21T07:04:32Z",
      "current_status": "down",
      "failure_category": "content_missing",
      "http_status": 200,
      "redirect_count": 0,
      "response_time_ms": 737,
      "tls_status": "not_applicable",
      "certificate_expires_at": null,
      "dns_status": "not_applicable",
      "content_status": "missing",
      "consecutive_failures": 8,
      "consecutive_successes": 0,
      "incident_id_hash": "1084caf605b6856546de3de963180da4178f02be7a8ff30cde83702b7d722c83",
      "incident_started_at": "2026-09-20T11:41:31Z"
    },
    {
      "monitor_id_hash": "1acfea4abf3c63a1145b3758e40f3602573b818e8a5539576a689d6ca8679c5f",
      "endpoint_category": "route_en",
      "last_check_at": "2026-09-21T07:04:32Z",
      "current_status": "down",
      "failure_category": "content_missing",
      "http_status": 200,
      "redirect_count": 0,
      "response_time_ms": 294,
      "tls_status": "not_applicable",
      "certificate_expires_at": null,
      "dns_status": "not_applicable",
      "content_status": "missing",
      "consecutive_failures": 8,
      "consecutive_successes": 0,
      "incident_id_hash": "1084caf605b6856546de3de963180da4178f02be7a8ff30cde83702b7d722c83",
      "incident_started_at": "2026-09-20T11:41:31Z"
    },
    {
      "monitor_id_hash": "16e98aac516fe24c913a3330454e44a6e3376ecb1be6241f16a6b16eb3a029e1",
      "endpoint_category": "route_ar",
      "last_check_at": "2026-09-21T07:04:32Z",
      "current_status": "down",
      "failure_category": "content_missing",
      "http_status": 200,
      "redirect_count": 0,
      "response_time_ms": 298,
      "tls_status": "not_applicable",
      "certificate_expires_at": null,
      "dns_status": "not_applicable",
      "content_status": "missing",
      "consecutive_failures": 8,
      "consecutive_successes": 0,
      "incident_id_hash": "1084caf605b6856546de3de963180da4178f02be7a8ff30cde83702b7d722c83",
      "incident_started_at": "2026-09-20T11:41:31Z"
    }
  ],
  "previous_evidence_fingerprint": "aa50bcab8da3f5cdedc63b08c12e6a8a2ebd77a9359cf68dfa2f74441e1e4b84",
  "evidence_fingerprint": "b3cde8df938585bde3fdba95859f8fc88dfe4ce98f38e43243ca1317f613f94e",
  "authentication": {
    "scheme": "ed25519",
    "key_id": "econnet-uptime-ed25519-2026-01",
    "signature_domain": "econnet-observer-external-uptime/1.0.0",
    "signature": "jCqRs9YWO7ApHcwKrz4rSL3NahhmxanhmLiRHdzbW3u84Z2WaQFceTtxCF1L9RlB2FWeOSkgJrXz/rx6e3rbAg=="
  }
}
