{
  "schema_version": "econnet-observer-external-uptime/1.0.0",
  "sequence": 10,
  "generated_at": "2026-07-30T23:44:01Z",
  "fresh_until": "2026-07-31T01:04:01Z",
  "producer": "github-actions-external-uptime",
  "observation_window": {
    "started_at": "2026-07-30T23:42:57Z",
    "ended_at": "2026-07-30T23:44:01Z"
  },
  "current_status": "healthy",
  "last_success_at": "2026-07-30T20:13:11Z",
  "last_incident": null,
  "uptime_24h_basis_points": 10000,
  "uptime_30d_basis_points": 10000,
  "endpoint_results": [
    {
      "monitor_id_hash": "ee5816560bb7f2fd926b78b7d47bf5281a4b7d7795ad5b8275e9520727e05db8",
      "endpoint_category": "dns",
      "last_check_at": "2026-07-30T23:42:57Z",
      "current_status": "healthy",
      "failure_category": "none",
      "http_status": null,
      "redirect_count": 0,
      "response_time_ms": null,
      "tls_status": "not_applicable",
      "certificate_expires_at": null,
      "dns_status": "resolved",
      "content_status": "not_applicable",
      "consecutive_failures": 0,
      "consecutive_successes": 11,
      "incident_id_hash": null,
      "incident_started_at": null
    },
    {
      "monitor_id_hash": "67fafe5bfcc53d87ac96d3c5c293a8c67d38e3d33837247099f7c1040471fd74",
      "endpoint_category": "tls",
      "last_check_at": "2026-07-30T23:42:57Z",
      "current_status": "healthy",
      "failure_category": "none",
      "http_status": null,
      "redirect_count": 0,
      "response_time_ms": null,
      "tls_status": "valid",
      "certificate_expires_at": "2026-10-20T07:09:46Z",
      "dns_status": "not_applicable",
      "content_status": "not_applicable",
      "consecutive_failures": 0,
      "consecutive_successes": 11,
      "incident_id_hash": null,
      "incident_started_at": null
    },
    {
      "monitor_id_hash": "e85ff9719c86c2f3096b02ffad2bce20d80ff46511147e5fd62d613027b7d148",
      "endpoint_category": "route_no",
      "last_check_at": "2026-07-30T23:42:57Z",
      "current_status": "down",
      "failure_category": "content_missing",
      "http_status": 200,
      "redirect_count": 0,
      "response_time_ms": 498,
      "tls_status": "not_applicable",
      "certificate_expires_at": null,
      "dns_status": "not_applicable",
      "content_status": "missing",
      "consecutive_failures": 1,
      "consecutive_successes": 0,
      "incident_id_hash": null,
      "incident_started_at": null
    },
    {
      "monitor_id_hash": "1acfea4abf3c63a1145b3758e40f3602573b818e8a5539576a689d6ca8679c5f",
      "endpoint_category": "route_en",
      "last_check_at": "2026-07-30T23:42:57Z",
      "current_status": "down",
      "failure_category": "content_missing",
      "http_status": 200,
      "redirect_count": 0,
      "response_time_ms": 106,
      "tls_status": "not_applicable",
      "certificate_expires_at": null,
      "dns_status": "not_applicable",
      "content_status": "missing",
      "consecutive_failures": 1,
      "consecutive_successes": 0,
      "incident_id_hash": null,
      "incident_started_at": null
    },
    {
      "monitor_id_hash": "16e98aac516fe24c913a3330454e44a6e3376ecb1be6241f16a6b16eb3a029e1",
      "endpoint_category": "route_ar",
      "last_check_at": "2026-07-30T23:42:57Z",
      "current_status": "down",
      "failure_category": "content_missing",
      "http_status": 200,
      "redirect_count": 0,
      "response_time_ms": 106,
      "tls_status": "not_applicable",
      "certificate_expires_at": null,
      "dns_status": "not_applicable",
      "content_status": "missing",
      "consecutive_failures": 1,
      "consecutive_successes": 0,
      "incident_id_hash": null,
      "incident_started_at": null
    }
  ],
  "previous_evidence_fingerprint": "8f7b8b9d432515a4a770c56c0b1f11b37f1917ff0d59fdcf6688af0132a5bc9e",
  "evidence_fingerprint": "c841ad9ac6b32a1f1c05a88bcecf97341d42428488c9f9867b8b9b6f4cd53c05",
  "authentication": {
    "scheme": "ed25519",
    "key_id": "econnet-uptime-ed25519-2026-01",
    "signature_domain": "econnet-observer-external-uptime/1.0.0",
    "signature": "SsmA0B5RkT/TSw+wJGfmZImgqq5zLmqVhjF/KuYn56jowB1GHY3FJzwOAR3Puop1ZULvk1HEVjyO1lDhwxnUDA=="
  }
}
